Name,Description,URL
CSE 454 Advanced Internet and Web Services (5),"Design of Internet search engines, including spider architecture, inverted indices, frequency rankings, latent semantic indexing, hyperlink analysis, and refinement interfaces. Construction of scalable and secure web services. Datamining webserver logs to provide personalized and user-targeted services. Large project. Prerequisite: CSE 332; CSE 351; either CSE 331 or CSE 352.",https://myplan.washington.edu/course/#/courses/CSE454
CSE 455 Computer Vision (4),"Introduction to image analysis and interpreting the 3D world from image data. Topics may include segmentation, motion estimation, image mosaics, 3D-shape reconstruction, object recognition, and image retrieval. Prerequisite: CSE 333; CSE 332.",https://myplan.washington.edu/course/#/courses/CSE455
CSE 456 Story Design for Computer Animation (4),"Animation principles and production for story development and design. Design, development, and production of several storyreels, which are a tool for the pre-production of animated features and shorts. Student use authoring tools to present finished work.",https://myplan.washington.edu/course/#/courses/CSE456
CSE 457 Computer Graphics (4),"Introduction to computer image synthesis, modeling, and animation. Topics may include visual perception, displays and framebuffers, image processing, affine and projective transformations, hierarchical modeling, hidden surface elimination, shading, ray-tracing, anti-aliasing, texture mapping, curves, surfaces, particle systems, dynamics, character animation, and animation principles. Prerequisite: CSE 333; CSE 332.",https://myplan.washington.edu/course/#/courses/CSE457
CSE 458 Computer Animation (5),"Introduction to basic principles of computer generated animation. Focus on the modeling and lighting of animated characters. Students from art, CSE, and music team up on projects to be built on commercially-available modeling and lighting packages. Prerequisite: CSE 457.",https://myplan.washington.edu/course/#/courses/CSE458
CSE 459 Pre-Production for Collaborative Animation (5),"Pre-production of collaboratively designed animated shorts. In-depth analysis of classical and computer generated works. Character design and pre-planning, model sheets, character rigging, storyreel and animatics, character motion, design for multiple characters, and principles of animation as applied to character motion and effects. Prerequisite: CSE 458.",https://myplan.washington.edu/course/#/courses/CSE459
CSE 460 Animation Capstone (5),"Apply the knowledge gained in previous animation courses to produce a short animated film. Topics include scene planning, digital cinematography, creature and hard surface modeling, animatics and basics of character animation, and rendering techniques. Prerequisite: CSE 458, CSE 459.",https://myplan.washington.edu/course/#/courses/CSE460
CSE 461 Introduction to Computer-Communication Networks (4),"Computer network architectures, protocol layers, network programming. Transmission media, encoding systems, switching, multiple access arbitration. Network routing, congestion control, flow control. Transport protocols, real-time, multicast, network security. Course overlaps with: CSS 431; T INFO 250; and TCES 425. Prerequisite: either CSE 326 or CSE 332; either CSE 303 or CSE 333.",https://myplan.washington.edu/course/#/courses/CSE461
CSE 462 Wireless Communication (4),"Fundamentals of wireless communication. Reliable communication over noisy, unreliable channels.  Signal to noise ratio, frequency domain analysis, bandwidth, capacity of noisy communication channels, modulation, channel coding, error detection, error correction. Connection between machine learning and communication such as decoding as inference and learning as compression. Prerequisite: MATH 208 and CSE 333.",https://myplan.washington.edu/course/#/courses/CSE462
"CSE 464 Advanced Topics in Digital Animation (1-5, max. 10)","Students design individual animated works for professional quality demo reels. 2- and 3-D animatics, special effects design, advanced character animation techniques, 3-D paint techniques and integration, short design, sequence planning, non-photorealistic rendering options, interactive animation for pre-planning, and advanced production techniques and strategies.",https://myplan.washington.edu/course/#/courses/CSE464
CSE 467 Advanced Digital Design (4),"Advanced techniques in the design of digital systems. Hardware description languages, combinational and sequential logic synthesis and optimization methods, partitioning, mapping to regular structures. Emphasis on reconfigurable logic as an implementation medium. Memory system design. Digital communication including serial/parallel and synchronous/asynchronous methods. Prerequisite: CSE 352; CSE 332.",https://myplan.washington.edu/course/#/courses/CSE467
CSE 469 Computer Architecture I (5),"Introduction to computer architecture. Assembly and machine language, microprocessor organization including control and datapath. Computer arithmetic. Memory systems and caching. Performance modeling of microprocessors. Prerequisite: either E E 271 or CSE 369;  and either CSE 123 or CSE 143. Offered: jointly with E E 469.",https://myplan.washington.edu/course/#/courses/CSE469
CSE 470 Computer Architecture II (4),Advanced computer architecture. Performance evaluation and energy efficiency. Instruction set architectures. Instruction-level parallelism. Modern microprocessor micro-architecture. Thread-level parallelism. Cache coherency and memory consistency in shared-memory multiprocessors. Memory hierarchy. GPU architecture. Warehouse-scale computing. Trends in computer design. Prerequisite: either CSE 469 or E E 469. Offered: jointly with E E 470.,https://myplan.washington.edu/course/#/courses/CSE470
CSE 472 Introduction to Computational Linguistics (5) A&H/NSc,"Introduction to computational approaches to modeling language, for linguistic research and practical applications, including analyses at different levels of linguistic structure and symbolic as well as statistical approaches. Prerequisite: either LING 200 or LING 400; either LING 461 or CSE 311. Offered: jointly with LING 472.",https://myplan.washington.edu/course/#/courses/CSE472
CSE 473 Introduction to Artificial Intelligence (3),"Principal ideas and developments in artificial intelligence: Problem solving and search, game playing, knowledge representation and reasoning, uncertainty, machine learning, natural language processing. Course overlaps with: CSE 415; CSS 382; and TCSS 435. Prerequisite: CSE 312 and CSE 332.",https://myplan.washington.edu/course/#/courses/CSE473
CSE 474 Introduction to Embedded Systems (4),"Introduces the specification, design, development, and test of real time embedded system software. Use of a modern embedded microcomputer or microcontroller as a target environment for a series of laboratory projects and a comprehensive final project. Course overlaps with: CSE 451; B ME 460; CSS 427; and TCES 460. Prerequisite: CSE 123 or CSE 143 Offered: jointly with E E 474; AWSpS.",https://myplan.washington.edu/course/#/courses/CSE474
CSE 475 Embedded Systems Capstone (5),"Capstone design experience. Prototype a substantial project mixing hardware, software, and communications. Focuses on embedded processors, programmable logic devices, and emerging platforms for the development of digital systems. Provides a comprehensive experience in specification, design, and management of contemporary embedded systems. Course overlaps with: TME 441. Prerequisite: E E 271 or CSE 369; and E E 472 or CSE 474/E E 474. Offered: jointly with E E 475.",https://myplan.washington.edu/course/#/courses/CSE475
CSE 478 Autonomous Robotics (4),"Theory and application of algorithms and probabilistic techniques for autonomous robotics. Covers topics related to state estimation (Bayes filtering, probabilistic motion and sensor models), planning/control (search based planners, lattice based planners, trajectory following techniques), and perception and learning (object detection, learning from demonstrations etc.). Prerequisite: CSE 332; recommended: CSE 312; MATH 208.",https://myplan.washington.edu/course/#/courses/CSE478
"CSE 480 Computer Ethics Seminar (1-3, max. 5) DIV","Reading and discussion seminar on the ethical issues surrounding sociotechnical systems and their impacts on society.  Includes historical perspectives and current topics.  Relates computer technology to ethical questions of power, politics, equity, privacy, autonomy, and more. Credit/no-credit only.",https://myplan.washington.edu/course/#/courses/CSE480
"CSE 481 Capstone Software Design (5, max. 15)","Student teams design and implement a software project involving multiple areas of the CSE curriculum. Course emphasizes the development process, rather than the product. Prerequisite: CSE 312; CSE 332; CSE 351; and either CSE 331, CSE 333, or CSE 369.",https://myplan.washington.edu/course/#/courses/CSE481
"CSE 482 Capstone Software Design to Empower Underserved Populations (5, max. 15) DIV","Students work in teams to design and implement a software project involving multiple areas of the CSE curriculum, for the purpose of empowering marginalized or underserved populations. Prerequisite: CSE 332; CSE 351; either CSE 331 or CSE 352.",https://myplan.washington.edu/course/#/courses/CSE482
CSE 484 Computer Security (4),"Foundations of modern computer security, including software security, operating system security, network security, applied cryptography, human factors, authentication, anonymity, and web security. Course overlaps with: E E 468. Prerequisite: CSE 332; CSE 351.",https://myplan.washington.edu/course/#/courses/CSE484
CSE 486 Introduction to Synthetic Biology (3),"Studies mathematical modeling of transcription, translation, regulation, and metabolism in cell; computer aided design methods for synthetic biology; implementation of information processing, Boolean logic and feedback control laws with genetic regulatory networks; modularity, impedance matching and isolation in biochemical circuits; and parameter estimation methods. Prerequisite: either MATH 136, MATH 207, MATH 307, AMATH 351, or CSE 311; and either MATH 208, MATH 308, or AMATH 352. Offered: jointly with BIOEN 423/CHEM E 476/E E 423.",https://myplan.washington.edu/course/#/courses/CSE486
CSE 487 Advanced Systems and Synthetic Biology (3),"Covers advanced concepts in system and synthetic biology. Includes kinetics, modeling, stoichiometry, control theory, metabolic systems, signaling, and motifs. All topics are set against problems in synthetic biology. Prerequisite: E E 423/BIOEN 423/CHEM E 476/CSE 486. Offered: jointly with BIOEN 424/CHEM E 477/E E 424.",https://myplan.washington.edu/course/#/courses/CSE487
CSE 488 Laboratory Methods in Synthetic Biology (4),"Designs and builds transgenic bacterial using promoters and genes taken from a variety of organisms. Uses construction techniques including recombination, gene synthesis, and gene extraction. Evaluates designs using sequencing, fluorescence assays, enzyme activity assays, and single cell studies using time-lapse microscopy. Prerequisite: E E 423/BIOEN 423/CHEM E 476/CSE 486; and either CHEM 142, CHEM 143, or CHEM 145. Offered: jointly with BIOEN 425/CHEM E 478/E E 425.",https://myplan.washington.edu/course/#/courses/CSE488
"CSE 490 Special Topics in Computer Science and Engineering (1-5, max. 15)","Lectures, discussions, and possibly labs on topics of current interest in computer science and engineering not covered by other CSE undergraduate courses.",https://myplan.washington.edu/course/#/courses/CSE490
CSE 491 Data Science and Society Seminar (1),"Current topics related to the societal implications of data science. Topic selection will vary from quarter to quarter and may include data privacy and security, data anonymization, hypothesis-testing on a shared database, impact of data science-based decisions on society. Includes both guest speakers and case-study or article-based discussions. Credit/no-credit only. Credit/no-credit only.",https://myplan.washington.edu/course/#/courses/CSE491
"CSE 492 Undergraduate Seminar (1-2, max. 5)",Seminars on current topics in computer science and engineering. Topic selection will vary from quarter to quarter. Credit/no-credit only.,https://myplan.washington.edu/course/#/courses/CSE492
"CSE 493 Advanced Special Topics in Computer Science and Engineering (1-5, max. 15)",Advanced topics in computer science and engineering.,https://myplan.washington.edu/course/#/courses/CSE493
"CSE 495 Project Practicum ([1-5]-, max. 5)","Available in special situations for computer science majors to compete, under instructor guidance, a substantial computing project that deepens one's knowledge and experience in the field. Projects may involve a group of students.",https://myplan.washington.edu/course/#/courses/CSE495
"CSE 496 Honors Undergraduate Research (1-9, max. 9)",Undergraduate research or design project carried out under the supervision of a faculty sponsor.,https://myplan.washington.edu/course/#/courses/CSE496
CSE 497 Undergraduate Research Seminar (1),Students prepare and give a public talk on their faculty-sponsored research projects.,https://myplan.washington.edu/course/#/courses/CSE497
"CSE 498 Undergraduate Research (1-9, max. 9)",Undergraduate research carried out under the supervision of a faculty sponsor.,https://myplan.washington.edu/course/#/courses/CSE498
"CSE 499 Reading and Research (1-24, max. 24)","Available in special situations for advanced computer science majors to do reading and research in field, subject to approval of undergraduate adviser and CSE faculty member. Free elective, but does not replace core course or computer science elective. Credit/no-credit only.",https://myplan.washington.edu/course/#/courses/CSE499
CSE 501 Programming Language Analysis and Implementation (4),"Design and implementation of compilers and run-time systems for imperative, object-oriented, and functional languages. Intra- and interprocedural analyses and optimizations. Prerequisite: CSE 341.",https://myplan.washington.edu/course/#/courses/CSE501
CSE 503 Software Engineering (4),"Specification, implementation, and testing of large, multiperson, software systems. Topics include abstraction, information hiding, software development environments, and formal specifications.",https://myplan.washington.edu/course/#/courses/CSE503
CSE 504 Advanced Topics in Software Engineering (4),"Topics vary but may include software design and evolution, formal methods, requirements specifications, software and system safety, reverse engineering, real-time software, metrics and measurement, programming environments, and verification and validation.",https://myplan.washington.edu/course/#/courses/CSE504
CSE 505 Principles of Programming Languages (4),"Design and formal semantics of modern programming languages, includes functional and object-oriented languages. Prerequisite: CSE 341.",https://myplan.washington.edu/course/#/courses/CSE505
CSE 506 Advanced Topics in Programming Languages (4),"May include functional, object-oriented, parallel, and logic programming languages; semantics for languages of these kinds; type declaration, inference, and checking (including polymorphic types); implementation issues, such as compilation, lazy evaluation, combinators, parallelism, various optimization techniques. Implementation project required. Prerequisite: CSE 501 which may be taken concurrently, and CSE 505.",https://myplan.washington.edu/course/#/courses/CSE506
CSE 507 Computer-Aided Reasoning for Software (4),"Covers theory, implementation, and applications of automated reasoning techniques, such as satisfiability solving, theorem proving, model checking, and abstract interpretation. Topics include concepts from mathematical logic and applications of automated reasoning to the design, construction, and analysis of software.",https://myplan.washington.edu/course/#/courses/CSE507
CSE 510 Advanced Topics in Human-Computer Interaction (4),"Content varies, including interface issues for networks, embedded systems, education applications, safety and critical systems, graphics and virtual reality, databases, and computer-supported cooperative work.",https://myplan.washington.edu/course/#/courses/CSE510
CSE 512 Data Visualization (4),"Covers techniques and algorithms for creating effective visualizations based on principles from graphic design, visual art, perceptual psychology, and cognitive science. Topics include data and image models; visual encoding; graphical perception; color; animation; interaction techniques; graph layout; and automated design. Lectures, reading, and project.",https://myplan.washington.edu/course/#/courses/CSE512
CSE 513 Disability Inclusion for Technologists (4),"Introduction to the future of access technologies. Topics include disability justice; accessibility technology; creating accessible applications and websites; accessibility concerns in a wide variety of computational topics such as security, fabrication, and augmented reality; and the importance of technology in addressing accessibility concerns in the world at large.",https://myplan.washington.edu/course/#/courses/CSE513
CSE 515 Statistical Methods in Computer Science (4),"Introduction to the probabilistic and statistical techniques used in modern computer systems. Graphical models, probabilistic inference, statistical learning, sequential models, decision theory. Prerequisite: either CSE 312,STAT 341, STAT 391 or equivalent.",https://myplan.washington.edu/course/#/courses/CSE515
CSE 517 Natural Language Processing (4),"Overview of modern approaches for natural language processing. Topics include language models, text, classification, tagging, parsing, machine translation, semantic, and discourse analysis.",https://myplan.washington.edu/course/#/courses/CSE517
"CSE 519 Current Research in Computer Science (1, max. 18)","Weekly presentations on current research activities by members of the department. Only computer science graduate students may register, although others are encouraged to attend. Credit/no-credit only.",https://myplan.washington.edu/course/#/courses/CSE519
"CSE 520 Computer Science Colloquium (1, max. 18)",Weekly public presentations on topics of current interest by visiting computer scientists. Credit/no-credit only.,https://myplan.washington.edu/course/#/courses/CSE520
CSE 521 Design and Analysis of Algorithms I (4),"Principles of design of efficient algorithms: recursion, divide and conquer, balancing, dynamic programming, greedy method, network flow, linear programming. Correctness and analysis of algorithms. NP-completeness. Prerequisite: either CSE 332 or equivalent.",https://myplan.washington.edu/course/#/courses/CSE521
CSE 522 Design and Analysis of Algorithms II (4),"Analysis of algorithms more sophisticated than those treated in CSE 521. Content varies and may include such topics as algebraic algorithms, combinational algorithms, techniques for proving lower bounds on complexity, and algorithms for special computing devices such as networks or formulas. Prerequisite: CSE 521.",https://myplan.washington.edu/course/#/courses/CSE522
CSE 523 Computational Geometry (4),"Algorithms for discrete computational geometry. Geometric computation, range searching, convex hulls, proximity, Vornoi diagrams, intersection. Application areas include VLSI design and computer graphics. Prerequisite: CSE 521.",https://myplan.washington.edu/course/#/courses/CSE523
CSE 524 Parallel Algorithms (4),"Design and analysis of parallel algorithms: fundamental parallel algorithms for sorting, arithmetic, matrix and graph problems, and additional selected topics. Emphasis on general techniques and approaches used for developing fast and efficient parallel algorithms and on limitations to their efficacy. Prerequisite: CSE 521.",https://myplan.washington.edu/course/#/courses/CSE524
CSE 525 Randomized Algorithms and Probabilistic Analysis (4),"Examines algorithmic techniques: random selection, random sampling, backwards analysis, algebraic methods, Monte Carlo methods, and randomized rounding; random graphs; the probabilistic method; Markov chains and random walks; and analysis tools: random variables, moments and deviations, Chernoff bounds, martingales, and balls in bins. Prerequisite: either CSE 521 or equivalent.",https://myplan.washington.edu/course/#/courses/CSE525
CSE 526 Cryptography (4),"Introduction to the theoretical foundation of cryptography, teaching the design and application of selected important cryptographic objects, and the mathematical frameworks and methodologies of modern cryptography for formalizing security goals and developing provably secure solutions. Course overlaps with: CSS 527.",https://myplan.washington.edu/course/#/courses/CSE526
CSE 527 Computational Biology (4),"Introduces computational methods leveraging artificial intelligence (AI) and machine learning (ML) techniques to understand biological systems and enhance healthcare. Utilizes various AI/ML techniques, including explainable AI, interpretable ML, deep learning, probabilistic graphical models, and causal inference.  Explores diverse problem areas such as genetics, epigenomics, transcriptomics, proteomics, imageomics, and electronic health records.",https://myplan.washington.edu/course/#/courses/CSE527
CSE 528 Computational Neuroscience (3),"Introduction to computational methods for understanding nervous systems and the principles governing their operation. Topics include representation of information by spiking neurons, information processing in neural circuits, and algorithms for adaptation and learning. Prerequisite: elementary calculus, linear algebra, and statistics, or permission of instructor. Offered: jointly with NEURO 528.",https://myplan.washington.edu/course/#/courses/CSE528
CSE 529 Computational Genomics (4),"Introduces computational and statistical approaches and practices for deriving robust and rigorous insights from modern genomics datasets.  Includes genomics-inspired problems in areas such as human genetics, regulatory genomics, and single cell genomics as well as relevant foundational statistical and computational concepts such as causal inference, hidden confounding factors, and model interpretation. Recommended: familiarity with general concepts in machine learning (e.g. CSE 446 or equivalent); and some familiarity with general principles of biology (e.g., college-level introductory course or equivalent).",https://myplan.washington.edu/course/#/courses/CSE529
CSE 531 Computational Complexity I (4),"Deterministic and nondeterministic time and space complexity, complexity classes, and complete problems. Time and space hierarchies. Alternation and the polynomial-time hierarchy. Circuit complexity. Probabilistic computation. Exponential complexity lower bounds. Interactive proofs. Prerequisite: either CSE 311 or equivalent.",https://myplan.washington.edu/course/#/courses/CSE531
CSE 532 Computational Complexity II (4),"Advanced computational complexity including several of the following: circuit complexity lower bounds, #p and counting classes, probabilistically-checkable proofs, de-randomization, logical characteristics of complexity, communication complexity, time-space tradeoffs, complexity of data structures.",https://myplan.washington.edu/course/#/courses/CSE532
CSE 533 Advanced Topics in Complexity Theory (4),An in-depth study of advanced topics in computational complexity.,https://myplan.washington.edu/course/#/courses/CSE533
CSE 534 Quantum Information and Computation (4),"Introduction to quantum information and computation. Qubits, quantum gates, and measurements. Entanglement and non-locality. Density matrix formalism. Quantum algorithms: Simon's algorithm, Grover search, Shor's factoring, and Hamiltonian Simulation. Quantum error-correction. Recommended: either solid background in mathematics and/or theoretical computer science, or prior familiarity with quantum-computing fundamentals.",https://myplan.washington.edu/course/#/courses/CSE534
CSE 535 Theory of Optimization and Continuous Algorithms (4),"Theoretical foundations of convex optimization and continuous algorithms. First-order methods, rates of convergence, and acceleration; gradient, subgradient, and mirror descent. Randomization, stochastic descent, leverage scores and sampling. Interior point methods. Linear systems in convex optimization. Algorithmic applications.",https://myplan.washington.edu/course/#/courses/CSE535
CSE 541 Interactive Learning (4),"Foundations and methods of interactive machine learning including multi-armed bandits, active learning, and adaptive experimental design. Stochastic and adversarial K-armed bandits, structured bandits, and contextual bandits. Online learning; adaptive data collection for supervised learning.",https://myplan.washington.edu/course/#/courses/CSE541
CSE 543 Deep Learning (4),"Foundations of modern deep learning and its applications. Topics include various forms of deep neural networks architectures such as convolution neural networks, recurrent networks, attention mechanism, training and optimization algorithms and their applications in domains such as computer vision, robotics, and natural language processing. Recommended: comfortable with programming; and working knowledge of linear algebra (MATH 208); vector calculus (MATH 126); probability and statistics (CSE 312 and STAT 390); algorithms (CSE 421); and machine learning (CSE 446 or CSE 546).",https://myplan.washington.edu/course/#/courses/CSE543
