Name,Description,URL
CSE 544 Principles of Database Systems (4),"Data models and query languages (SQL, datalog, OQL). Relational databases, enforcement of integrity constraints. Object-oriented databases and object-relational databases. Principles of data storage and indexing. Query-execution methods and query optimization algorithms. Static analysis of queries and rewriting of queries using views. Data integration. Data mining. Principles of transaction processing.",https://myplan.washington.edu/course/#/courses/CSE544
CSE 546 Machine Learning (4),"Explores methods for designing systems that learn from data and improve with experience. Supervised learning and predictive modeling; decision trees, rule induction, nearest neighbors, Bayesian methods, neural networks, support vector machines, and model ensembles. Unsupervised learning and clustering. Prerequisite: either CSE 312, STAT 341, STAT 391 or equivalent.",https://myplan.washington.edu/course/#/courses/CSE546
CSE 547 Machine Learning for Big Data (4),"Covers machine learning and statistical techniques for analyzing datasets of massive size and dimensionality. Representations include regularized linear models, graphical models, matrix factorization, sparsity, clustering, and latent factor models. Algorithms include sketching, random projections, hashing, fast nearest-neighbors, large-scale online learning, and parallel learning (Map-Reduce, GraphLab). Prerequisite: either STAT 535 or CSE 546. Offered: jointly with STAT 548; W.",https://myplan.washington.edu/course/#/courses/CSE547
CSE 548 Computer Systems Architecture (4),"Notations for computer systems. Processor design (single chip, look-ahead, pipelined, data flow). Memory hierarchy organization and management (virtual memory and caches). Microprogramming. I/O processing. Multiprocessors (SIMD and MIMD). Course overlaps with: TECE 510. Prerequisite: CSE 451.",https://myplan.washington.edu/course/#/courses/CSE548
CSE 549 High-Performance Computer Architectures (4),"Algorithm design, software techniques, computer organizations for high-performance computing systems. Selected topics from: VLSI complexity for parallel algorithms, compiling techniques for parallel and vector machines, large MIMD machines, interconnection networks, reconfigurable systems, memory hierarchies in multiprocessors, algorithmically specialized processors, data flow architectures. Course overlaps with: TECE 510. Prerequisite: CSE 548 or permission of instructor.",https://myplan.washington.edu/course/#/courses/CSE549
CSE 550 Computer Systems (4),"Explores computer system design, implementation, and evaluation. Covers principles, techniques, and examples related to the construction of computer systems, including concepts that span network systems, operating systems, web servers, parallel computing, and databases. Prerequisite: CSE 451.",https://myplan.washington.edu/course/#/courses/CSE550
CSE 551 Operating Systems (4),"Operating system design and construction techniques. Concurrent programming, operating system kernels, correctness, deadlock, protection, transaction processing, design methodologies, comparative structure of different kinds of operating systems, and other topics. Prerequisite: CSE 451.",https://myplan.washington.edu/course/#/courses/CSE551
CSE 552 Distributed and Parallel Systems (4),"Principles, techniques, and examples related to the design, implementation, and analysis of distributed and parallel computer systems. Course overlaps with: TECE 514. Prerequisite: CSE 551.",https://myplan.washington.edu/course/#/courses/CSE552
CSE 553 Real-Time Systems (4),Design and construction of software for real-time computer systems. Software architectures. Requirements and specification methods. Scheduling algorithms and timing analysis. Real-time operating systems. Real-time programming languages. Selected case studies. Prerequisite: CSE 451.,https://myplan.washington.edu/course/#/courses/CSE553
CSE 556 Computational Fabrication (4),"Overview of the computational tools and concepts used throughout the modern pipeline for computational fabrication, including topics such as hardware abstraction languages, geometry processing fundamentals, physics-based simulation, optimization techniques, data-driven design methods, and algorithms for high-performance interactive applications.",https://myplan.washington.edu/course/#/courses/CSE556
CSE 557 Computer Graphics (4),"Introduction to image synthesis and computer modeling, emphasizing the underlying theory required for undertaking computer graphics research. Topics include color theory, image processing, affine and projective geometry, hidden-surface determination, photorealistic image synthesis, advanced curve and surface design, dynamics, realistic character animation. Prerequisite: solid knowledge of linear algebra.",https://myplan.washington.edu/course/#/courses/CSE557
CSE 558 Special Topics in Computer Graphics (4),"Advanced topics in computer graphics not treated in CSE 557. Topics vary from year to year but typically include advanced aspects of image synthesis, animation, and 3D photography. Prerequisite: CSE 557 or permission of instructor.",https://myplan.washington.edu/course/#/courses/CSE558
CSE 561 Computer Communication and Networks (4),"Fundamentals of data transmission: coding, message formats, and protocols. Organization of computer networks. Examples of network implementations. Prerequisite: either CSE 451 or equivalent.",https://myplan.washington.edu/course/#/courses/CSE561
CSE 564 Computer Security and Privacy (4),"Examines the fundamentals of computer security including: human factors; attack detection, measurements, and models; cryptography and communications security; system design and implementation; and side channels.",https://myplan.washington.edu/course/#/courses/CSE564
CSE 567 Principles of Digital Systems Design (4),"Principles of logic design, combinational and sequential circuits, minimization techniques, structured design methods, CMOS technology, complementary and ratioed gates, delay estimation and performance analysis, arithmetic circuits, memories, clocking methodologies, synthesis and simulation tools, VLSI processor architecture. Course overlaps with: TECE 523. Prerequisite: basic knowledge of logic design.",https://myplan.washington.edu/course/#/courses/CSE567
CSE 568 Introduction to VLSI Systems (4),"Introduction to CMOS technology and circuit design; combinational logic-design alternatives; register-design and system-clocking methodologies; datapath and subsystem design; VLSI system-design methodologies; CAD tools for synthesis, layout, simulation, and validation; design of a complex VLSI chip. Course overlaps with: TECE 521. Prerequisite: either CSE 567 or permission of instructor.",https://myplan.washington.edu/course/#/courses/CSE568
CSE 571 AI-based Mobile Robotics (4),"Overview of mobile robot control and sensing. Behavior-based control, world modeling, localization, navigation, and planning Probabilistic sensor interpretation, Bayers filters, particle filters. Projects: Program real robots to perform navigation tasks. Prerequisite: either CSE 473 or permission of instructor.",https://myplan.washington.edu/course/#/courses/CSE571
CSE 573 Artificial Intelligence (4),"Broad introduction to the science of automated rational decision-making by machines.  Key approaches include search, Markov decision processes, graphical models, reinforcement learning, and supervised learning.  Considers a wide variety of application domains (e.g., natural language processing, computer vision, robotics, games) for decision making. Recommended: familiarity with data structures; algorithms; probability; and computer programming.",https://myplan.washington.edu/course/#/courses/CSE573
CSE 574 Explainable Artificial Intelligence (4),"Approaches to enhancing the interpretability and transparency of complex machine learning models, encompassing both inherently interpretable models and post hoc explanation methods.  Explores a spectrum of techniques, ranging from feature attributions and their evaluation metrics to counterfactual explanations, concept-based explanations, instance explanations, and collaboration between humans and artificial intelligence.",https://myplan.washington.edu/course/#/courses/CSE574
CSE 576 Computer Vision (3),"Principles and methods for interpreting the three-dimensional world from images. Topics include feature detection, image segmentation, motion estimation, image mosaics, 3D-shape reconstruction, object recognition, and image retrieval. Prerequisite: solid knowledge of linear algebra; good programming skills. Offered: jointly with E E 576.",https://myplan.washington.edu/course/#/courses/CSE576
CSE 577 Special Topics in Computer Vision (3),"Topics vary and may include vision for graphics, probabilistic vision and learning, medical imaging, content-based image and video retrieval, robot vision, or 3D object recognition. Prerequisite: CSE 576/E E 576. Offered: jointly with E E 577.",https://myplan.washington.edu/course/#/courses/CSE577
CSE 578 Convex Optimization (4),"Basics of convex analysis: Convex sets, functions, and optimization problems. Optimization theory: Least-squares, linear, quadratic, geometric and semidefinite programming. Convex modeling. Duality theory. Optimality and KKT conditions. Applications in signal processing, statistics, machine learning, control communications, and design of engineering systems. Prerequisite: A A 510, CHEM E 510, E E 510, or M E 510. Offered: jointly with A A 578/E E 578/M E 578.",https://myplan.washington.edu/course/#/courses/CSE578
CSE 579 Intelligent Control through Learning and Optimization (3),"Design or near-optimal controllers for complex dynamical systems, using analytical techniques, machine learning, and optimization. Topics from deterministic and stochastic optimal control, reinforcement learning and dynamic programming, numerical optimization in the context of control, and robotics. Prerequisite: vector calculus; linear algebra; MATLAB. Offered: jointly with AMATH 571.",https://myplan.washington.edu/course/#/courses/CSE579
CSE 580 Computing for Social Good (4),"Explorations of computing for social good projects. Topics include best practices, exemplars of success and failure, differing theories of change and perspectives on technology's role in progress. Students are expected to develop a solution grounded in their own perspective of social good.",https://myplan.washington.edu/course/#/courses/CSE580
CSE 581 Computer Ethics (4),Ethical and philosophical approaches to thinking critically about computing technology.  Tools and strategies for considering unintended consequences.  Responsibilities of computer science researchers and practitioners.  Application to various technology areas.,https://myplan.washington.edu/course/#/courses/CSE581
CSE 582 Ethics in Artificial Intelligence (4),"Real-world people-facing artificial intelligence (AI) applications, ethical implications in their design, and technical solutions to mitigate ethical risks. Topics in the intersection of AI, ethics, and computing for social good, centered around foundational and recent research. Foundations of research ethics, case studies in ethical AI, ethical challenges in developing intelligent systems, and machine learning approaches to address these issues. Prerequisite: CSE 446 or CSE 546.",https://myplan.washington.edu/course/#/courses/CSE582
CSE 583 Software Development for Data Scientists (4),"Provides students outside of CSE with a practical knowledge of software development that is sufficient to do graduate work in their discipline. Modules include Python basics, software version control, software design, and using Python for machine learning and visualization. Course overlaps with: CHEM E 546/CHEM 546.",https://myplan.washington.edu/course/#/courses/CSE583
CSE 586 Introduction to Synthetic Biology (3),"Studies mathematical modeling of transcription, translation, regulation, and metabolism in cell; computer aided design methods for synthetic biology; implementation of information processing, Boolean logic and feedback control laws with genetic regulatory networks; modularity, impedance matching and isolation in biochemical circuits; and parameter estimation methods. Prerequisite: either MATH 136, MATH 207, MATH 307, AMATH 351, or CSE 311; and either MATH 208, MATH 308, or AMATH 352. Offered: jointly with BIOEN 523/CHEM E 576/E E 523/MOLENG 525.",https://myplan.washington.edu/course/#/courses/CSE586
CSE 587 Advanced Systems and Synthetic Biology (3),"Covers advanced concepts in system and synthetic biology. Includes kinetics, modeling, stoichiometry, control theory, metabolic systems, signaling, and motifs. All topics are set against problems in synthetic biology. Prerequisite: E E 523/BIOEN 523/CHEM E 576/CSE 586/MOLENG 525. Offered: jointly with BIOEN 524/CHEM E 577/E E 524.",https://myplan.washington.edu/course/#/courses/CSE587
CSE 589 Software Entrepreneurship (4),"A case- and project-based course, focusing on starting a software or hardware company. Guest entrepreneurs, lawyers, and financiers discuss market identification and analysis, planning the business, financing, and typical operating and administrative problems. Offered: jointly with CSE P 589/ENTRE 532.",https://myplan.washington.edu/course/#/courses/CSE589
"CSE 590 Research Seminar (*, max. 50)","Several offerings each quarter, on topics of current interest.",https://myplan.washington.edu/course/#/courses/CSE590
"CSE 591 Group Projects in Computer Science (1-3, max. 25)",Focuses on specialized topics and research activities in computer science.,https://myplan.washington.edu/course/#/courses/CSE591
"CSE 599 Special Topics in Computer Science (1-5, max. 30)",Studies of emerging areas and specialized topics in computer science.,https://myplan.washington.edu/course/#/courses/CSE599
CSE 600 Independent Study or Research (*-),Credit/no-credit only.,https://myplan.washington.edu/course/#/courses/CSE600
"CSE 601 Internship (1-2, max. 12)",CSE Internship practicum; integration of classroom theory with on-the-job training. Periods of full-time work alternate with periods of full-time study. Open only to students who have been admitted to CSE Internship Program or by special permission of the Department. Credit/no-credit only. Offered: AWSpS.,https://myplan.washington.edu/course/#/courses/CSE601
CSE 700 Master's Thesis (*-),Credit/no-credit only.,https://myplan.washington.edu/course/#/courses/CSE700
CSE 800 Doctoral Dissertation (*-),Credit/no-credit only.,https://myplan.washington.edu/course/#/courses/CSE800
